Name,Address,Website,Type,useless_addr,useful_addr,clean_addr
加高電子股份有限公司,高雄市大寮區大發工業區華東路39號,http://www.hele.com.tw,公司,"",高雄市大寮區大發工業區華東路39號,高雄市大寮區大發工業區華東路39號
台灣精星科技股份有限公司,新竹縣湖口鄉鳳凰村實踐路12號,http://www.psaitc.com,公司,"",新竹縣湖口鄉鳳凰村實踐路12號,新竹縣湖口鄉鳳凰村實踐路12號
旭源包裝科技股份有限公司,新竹縣湖口鄉新竹工業區中華路122-18號,www.xuyuanpack.com,公司,"",新竹縣湖口鄉新竹工業區中華路122-18號,新竹縣湖口鄉新竹工業區中華路122號
裕國冷凍冷藏股份有限公司,台中市西屯區工業二路三號,www.cooleagle.com.tw,公司,"",台中市西屯區工業二路三號,台中市西屯區工業二路三號
台灣汽電共生股份有限公司,北市內湖區瑞光路392號6樓,www.cogen.com.tw,公司,6樓,北市內湖區瑞光路392號,北市內湖區瑞光路392號
合騏工業股份有限公司,嘉義縣義竹鄉義竹工業區義工二路二號,www.hercheemoto.com.tw,公司,"",嘉義縣義竹鄉義竹工業區義工二路二號,嘉義縣義竹鄉義竹工業區義工二路二號
成霖企業股份有限公司,台中市潭子區(台中加工出口區)建國路22號,https://tw.globeunion.com/,公司,"",台中市潭子區(台中加工出口區)建國路22號,台中市潭子區(台中加工出口區)建國路22號
宏全國際股份有限公司,台中市西屯區工業區2路6號,www.honchuan.com,公司,"",台中市西屯區工業區2路6號,台中市西屯區工業區2路6號
茂順密封元件科技股份有限公司,南投市南崗工業區工業路336號,www.nak.com.tw,公司,"",南投市南崗工業區工業路336號,南投市南崗工業區工業路336號
